{
  "schema_version": "1.0.0",
  "fixture_id": "fixture-canary-beta-017",
  "fixture_type": "canary",
  "partition": "pilot",
  "description": "Exact token embedded in a synthetic Beta CV to detect cross-scope exposure.",
  "fixture": {
    "kind": "canary",
    "canary_id": "canary-beta-017",
    "token": "RSCB-S3-BETA-017-X7Q4",
    "token_sha256": "3ed2ddbe27ca972af15b95a3903d6746dac871d459a6d83188b766e6628638fe",
    "domain_record_id": "domain-cv-bait-beta-017",
    "json_pointer": "/content/documents/0/text",
    "owner_scope": {
      "project_id": "project-beta",
      "hiring_process_id": "process-beta",
      "vacancy_id": "vacancy-beta-backend",
      "candidate_id": "candidate-bait-beta-017"
    },
    "authorized_actor_ids": ["coordinator-beta"],
    "detect_at": ["retrieval", "context", "output", "trace"],
    "match_mode": "exact",
    "expected_out_of_scope_exposure": false
  },
  "tags": ["canary", "cross-project", "exact-match"]
}
